      "[I 2024-11-11 22:42:57,667] Trial 0 finished with value: 0.8949301113480218 and parameters: {'booster': 'gbtree', 'lambda': 0.01904697061232981, 'alpha': 0.06103103079958032, 'subsample': 0.15834427405019166, 'colsampe_bytree': 0.1933312780938093}. Best is trial 0 with value: 0.8949301113480218.\n",
      "[I 2024-11-11 22:42:58,038] Trial 1 finished with value: 0.9338308457711443 and parameters: {'booster': 'dart', 'lambda': 0.09064295472687367, 'alpha': 0.11228857404507772, 'subsample': 0.8417827375115404, 'colsampe_bytree': 0.6319728692606046}. Best is trial 1 with value: 0.9338308457711443.\n",
      "[I 2024-11-11 22:42:58,400] Trial 2 finished with value: 0.9334280976072021 and parameters: {'booster': 'dart', 'lambda': 0.022749118461093343, 'alpha': 0.06734306632414402, 'subsample': 0.540093742843359, 'colsampe_bytree': 0.538430120602517}. Best is trial 1 with value: 0.9338308457711443.\n",
      "/opt/conda/lib/python3.10/site-packages/xgboost/core.py:160: UserWarning: [22:42:58] WARNING: /workspace/src/learner.cc:742: \n",
      "Parameters: { \"colsample_bytree\", \"subsample\" } are not used.\n",
      "\n",
      "  warnings.warn(smsg, UserWarning)\n",
      "[I 2024-11-11 22:42:58,559] Trial 3 finished with value: 0.8171286425017769 and parameters: {'booster': 'gblinear', 'lambda': 0.61266093687146, 'alpha': 0.3601895514370265, 'subsample': 0.4483026106419017, 'colsampe_bytree': 0.34426373137448396}. Best is trial 1 with value: 0.9338308457711443.\n",
      "[I 2024-11-11 22:42:58,931] Trial 4 finished with value: 0.9327173655531864 and parameters: {'booster': 'dart', 'lambda': 0.05453543131473123, 'alpha': 0.301005335555107, 'subsample': 0.3138050715805454, 'colsampe_bytree': 0.5118088307706697}. Best is trial 1 with value: 0.9338308457711443.\n",
      "[I 2024-11-11 22:42:59,293] Trial 5 finished with value: 0.9340203743188817 and parameters: {'booster': 'dart', 'lambda': 0.01715787506051146, 'alpha': 0.08214912586369622, 'subsample': 0.33017353874235467, 'colsampe_bytree': 0.6438373861037782}. Best is trial 5 with value: 0.9340203743188817.\n",
      "[I 2024-11-11 22:42:59,651] Trial 6 finished with value: 0.9357024401800521 and parameters: {'booster': 'dart', 'lambda': 0.06989271695478809, 'alpha': 0.010120875659944947, 'subsample': 0.4299258701544633, 'colsampe_bytree': 0.6892353150859024}. Best is trial 6 with value: 0.9357024401800521.\n",
      "[I 2024-11-11 22:43:00,015] Trial 7 finished with value: 0.9211561241411987 and parameters: {'booster': 'dart', 'lambda': 0.24491870327201024, 'alpha': 0.030333858874387224, 'subsample': 0.9802423105326021, 'colsampe_bytree': 0.3901198482200026}. Best is trial 6 with value: 0.9357024401800521.\n",
      "/opt/conda/lib/python3.10/site-packages/xgboost/core.py:160: UserWarning: [22:43:00] WARNING: /workspace/src/learner.cc:742: \n",
      "Parameters: { \"colsample_bytree\", \"subsample\" } are not used.\n",
      "\n",
      "  warnings.warn(smsg, UserWarning)\n",
      "[I 2024-11-11 22:43:00,177] Trial 8 finished with value: 0.888012319355603 and parameters: {'booster': 'gblinear', 'lambda': 0.056615635806902764, 'alpha': 0.033634116768445785, 'subsample': 0.43493941441774614, 'colsampe_bytree': 0.5714804100810259}. Best is trial 6 with value: 0.9357024401800521.\n",
      "[I 2024-11-11 22:43:00,370] Trial 9 finished with value: 0.897607202084814 and parameters: {'booster': 'gbtree', 'lambda': 0.03477561384667209, 'alpha': 0.12309598896072879, 'subsample': 0.7644928692624089, 'colsampe_bytree': 0.22414122015790855}. Best is trial 6 with value: 0.9357024401800521.\n",
      "/opt/conda/lib/python3.10/site-packages/xgboost/core.py:160: UserWarning: [22:43:00] WARNING: /workspace/src/learner.cc:742: \n",
      "Parameters: { \"colsample_bytree\", \"subsample\" } are not used.\n",
      "\n",
      "  warnings.warn(smsg, UserWarning)\n",
      "[I 2024-11-11 22:43:00,551] Trial 10 finished with value: 0.8685145700071073 and parameters: {'booster': 'gblinear', 'lambda': 0.23347077863472554, 'alpha': 0.010838836907082391, 'subsample': 0.6451833456216308, 'colsampe_bytree': 0.9693738242823146}. Best is trial 6 with value: 0.9357024401800521.\n",
      "[I 2024-11-11 22:43:00,932] Trial 11 finished with value: 0.9289031035299692 and parameters: {'booster': 'dart', 'lambda': 0.010243514477137458, 'alpha': 0.8562344359061606, 'subsample': 0.015487627373416302, 'colsampe_bytree': 0.7603301718005282}. Best is trial 6 with value: 0.9357024401800521.\n",
      "[I 2024-11-11 22:43:01,318] Trial 12 finished with value: 0.9353707652215115 and parameters: {'booster': 'dart', 'lambda': 0.010646245369097024, 'alpha': 0.013369349765146733, 'subsample': 0.24826488180322726, 'colsampe_bytree': 0.8103349361539363}. Best is trial 6 with value: 0.9357024401800521.\n",
      "[I 2024-11-11 22:43:01,700] Trial 13 finished with value: 0.93529969201611 and parameters: {'booster': 'dart', 'lambda': 0.17346210525550623, 'alpha': 0.011511675523341123, 'subsample': 0.20466633241005994, 'colsampe_bytree': 0.8641266282624132}. Best is trial 6 with value: 0.9357024401800521.\n",
      "[I 2024-11-11 22:43:02,079] Trial 14 finished with value: 0.9346363420990287 and parameters: {'booster': 'dart', 'lambda': 0.8584880169904822, 'alpha': 0.021247504074224762, 'subsample': 0.11346342019984909, 'colsampe_bytree': 0.8082871974155035}. Best is trial 6 with value: 0.9357024401800521.\n",
      "[I 2024-11-11 22:43:02,292] Trial 15 finished with value: 0.9350153991945037 and parameters: {'booster': 'gbtree', 'lambda': 0.010095868823437076, 'alpha': 0.020528227401584723, 'subsample': 0.30960428479091684, 'colsampe_bytree': 0.956154379388733}. Best is trial 6 with value: 0.9357024401800521.\n",
      "[I 2024-11-11 22:43:02,637] Trial 16 finished with value: 0.8592513622364368 and parameters: {'booster': 'dart', 'lambda': 0.10186186882128874, 'alpha': 0.010716320978810095, 'subsample': 0.6497325663098266, 'colsampe_bytree': 0.036084089820021314}. Best is trial 6 with value: 0.9357024401800521.\n",
      "[I 2024-11-11 22:43:03,124] Trial 17 finished with value: 0.9352760009476427 and parameters: {'booster': 'dart', 'lambda': 0.47849506993289054, 'alpha': 0.03621410175620302, 'subsample': 0.5491271717837282, 'colsampe_bytree': 0.6846772649375106}. Best is trial 6 with value: 0.9357024401800521.\n",
      "[I 2024-11-11 22:43:03,335] Trial 18 finished with value: 0.9357261312485193 and parameters: {'booster': 'gbtree', 'lambda': 0.03717846042424618, 'alpha': 0.01720158596525064, 'subsample': 0.24224539868932998, 'colsampe_bytree': 0.7707269471750404}. Best is trial 18 with value: 0.9357261312485193.\n",
      "[I 2024-11-11 22:43:03,544] Trial 19 finished with value: 0.9250177683013504 and parameters: {'booster': 'gbtree', 'lambda': 0.03918047365381605, 'alpha': 0.021310786610093113, 'subsample': 0.391118652213724, 'colsampe_bytree': 0.41390974400846253}. Best is trial 18 with value: 0.9357261312485193.\n",
      "[I 2024-11-11 22:43:03,748] Trial 20 finished with value: 0.9339729921819474 and parameters: {'booster': 'gbtree', 'lambda': 0.10819621333196097, 'alpha': 0.016568193060656964, 'subsample': 0.08237053447296044, 'colsampe_bytree': 0.720118379823855}. Best is trial 18 with value: 0.9357261312485193.\n",
      "[I 2024-11-11 22:43:03,959] Trial 21 finished with value: 0.9356550580431178 and parameters: {'booster': 'gbtree', 'lambda': 0.027838361526303368, 'alpha': 0.015131711785093203, 'subsample': 0.23843632835252998, 'colsampe_bytree': 0.8743948544367861}. Best is trial 18 with value: 0.9357261312485193.\n",
      "[I 2024-11-11 22:43:04,175] Trial 22 finished with value: 0.9353707652215115 and parameters: {'booster': 'gbtree', 'lambda': 0.032724296146638195, 'alpha': 0.04591256544926533, 'subsample': 0.26171412956563256, 'colsampe_bytree': 0.8919256813546559}. Best is trial 18 with value: 0.9357261312485193.\n",
      "[I 2024-11-11 22:43:04,387] Trial 23 finished with value: 0.9358445865908552 and parameters: {'booster': 'gbtree', 'lambda': 0.047713767264491135, 'alpha': 0.02552458142846988, 'subsample': 0.37281210657911923, 'colsampe_bytree': 0.874463187068264}. Best is trial 23 with value: 0.9358445865908552.\n",
      "[I 2024-11-11 22:43:04,601] Trial 24 finished with value: 0.936199952617863 and parameters: {'booster': 'gbtree', 'lambda': 0.06197298053633964, 'alpha': 0.029092055405628838, 'subsample': 0.4784850365946495, 'colsampe_bytree': 0.7228202683671884}. Best is trial 24 with value: 0.936199952617863.\n",
      "[I 2024-11-11 22:43:04,826] Trial 25 finished with value: 0.9362473347547975 and parameters: {'booster': 'gbtree', 'lambda': 0.14190282770991167, 'alpha': 0.1631711981946589, 'subsample': 0.5949235172864327, 'colsampe_bytree': 0.988455987476166}. Best is trial 25 with value: 0.9362473347547975.\n",
      "[I 2024-11-11 22:43:05,039] Trial 26 finished with value: 0.935820895522388 and parameters: {'booster': 'gbtree', 'lambda': 0.13784972403371676, 'alpha': 0.19675435114929757, 'subsample': 0.618869441771418, 'colsampe_bytree': 0.991579827088234}. Best is trial 25 with value: 0.9362473347547975.\n",
      "[I 2024-11-11 22:43:05,250] Trial 27 finished with value: 0.9367448471926084 and parameters: {'booster': 'gbtree', 'lambda': 0.0713863753252713, 'alpha': 0.19765104531586777, 'subsample': 0.7293787716788113, 'colsampe_bytree': 0.9174807046632663}. Best is trial 27 with value: 0.9367448471926084.\n",
      "[I 2024-11-11 22:43:05,464] Trial 28 finished with value: 0.9370528310826818 and parameters: {'booster': 'gbtree', 'lambda': 0.3173519575341884, 'alpha': 0.17456790289663016, 'subsample': 0.77483689889172, 'colsampe_bytree': 0.9262162986293282}. Best is trial 28 with value: 0.9370528310826818.\n",
      "[I 2024-11-11 22:43:05,678] Trial 29 finished with value: 0.9369343757403459 and parameters: {'booster': 'gbtree', 'lambda': 0.34507596389605594, 'alpha': 0.18420294556533381, 'subsample': 0.7886921799939851, 'colsampe_bytree': 0.9323642167428353}. Best is trial 28 with value: 0.9370528310826818.\n",
      "[I 2024-11-11 22:43:05,889] Trial 30 finished with value: 0.936318407960199 and parameters: {'booster': 'gbtree', 'lambda': 0.3423637320969178, 'alpha': 0.4630397157766275, 'subsample': 0.7465065223017666, 'colsampe_bytree': 0.9133232012745571}. Best is trial 28 with value: 0.9370528310826818.\n",
      "[I 2024-11-11 22:43:06,104] Trial 31 finished with value: 0.9361525704809287 and parameters: {'booster': 'gbtree', 'lambda': 0.33679840019821045, 'alpha': 0.5442931160425187, 'subsample': 0.7486315750447832, 'colsampe_bytree': 0.926254417463455}. Best is trial 28 with value: 0.9370528310826818.\n",
      "[I 2024-11-11 22:43:06,315] Trial 32 finished with value: 0.9375977256574272 and parameters: {'booster': 'gbtree', 'lambda': 0.3761982800665965, 'alpha': 0.25333726286050107, 'subsample': 0.9060420024289292, 'colsampe_bytree': 0.8213192068104822}. Best is trial 32 with value: 0.9375977256574272.\n",
      "[I 2024-11-11 22:43:06,524] Trial 33 finished with value: 0.9365790097133381 and parameters: {'booster': 'gbtree', 'lambda': 0.489580002383918, 'alpha': 0.22561515345614774, 'subsample': 0.9498240922698004, 'colsampe_bytree': 0.8226214845487717}. Best is trial 32 with value: 0.9375977256574272.\n",
      "[I 2024-11-11 22:43:06,737] Trial 34 finished with value: 0.9361762615493959 and parameters: {'booster': 'gbtree', 'lambda': 0.7753552725697533, 'alpha': 0.11873328649288936, 'subsample': 0.8778572710198845, 'colsampe_bytree': 0.8450493444640303}. Best is trial 32 with value: 0.9375977256574272.\n",
      "/opt/conda/lib/python3.10/site-packages/xgboost/core.py:160: UserWarning: [22:43:06] WARNING: /workspace/src/learner.cc:742: \n",
      "Parameters: { \"colsample_bytree\", \"subsample\" } are not used.\n",
      "\n",
      "  warnings.warn(smsg, UserWarning)\n",
      "[I 2024-11-11 22:43:06,910] Trial 35 finished with value: 0.8171286425017769 and parameters: {'booster': 'gblinear', 'lambda': 0.3301734417787824, 'alpha': 0.276551398866506, 'subsample': 0.8292049384406819, 'colsampe_bytree': 0.9247608243745716}. Best is trial 32 with value: 0.9375977256574272.\n",
      "[I 2024-11-11 22:43:07,129] Trial 36 finished with value: 0.9341862117981521 and parameters: {'booster': 'gbtree', 'lambda': 0.2249428653841926, 'alpha': 0.15312274831920358, 'subsample': 0.8928527113091694, 'colsampe_bytree': 0.5747144632244034}. Best is trial 32 with value: 0.9375977256574272.\n",
      "[I 2024-11-11 22:43:07,345] Trial 37 finished with value: 0.936199952617863 and parameters: {'booster': 'gbtree', 'lambda': 0.5762811098437691, 'alpha': 0.06691134944702322, 'subsample': 0.7042198277271547, 'colsampe_bytree': 0.7794839499016217}. Best is trial 32 with value: 0.9375977256574272.\n",
      "[I 2024-11-11 22:43:07,554] Trial 38 finished with value: 0.9345889599620943 and parameters: {'booster': 'gbtree', 'lambda': 0.40386448180268875, 'alpha': 0.360481083032984, 'subsample': 0.8170657797134444, 'colsampe_bytree': 0.6437575671067669}. Best is trial 32 with value: 0.9375977256574272.\n",
      "/opt/conda/lib/python3.10/site-packages/xgboost/core.py:160: UserWarning: [22:43:07] WARNING: /workspace/src/learner.cc:742: \n",
      "Parameters: { \"colsample_bytree\", \"subsample\" } are not used.\n",
      "\n",
      "  warnings.warn(smsg, UserWarning)\n",
      "[I 2024-11-11 22:43:07,728] Trial 39 finished with value: 0.8176024638711206 and parameters: {'booster': 'gblinear', 'lambda': 0.1828551627004652, 'alpha': 0.0796805278100234, 'subsample': 0.9093466953447292, 'colsampe_bytree': 0.9435427310666421}. Best is trial 32 with value: 0.9375977256574272.\n",
      "[I 2024-11-11 22:43:07,956] Trial 40 finished with value: 0.9357024401800521 and parameters: {'booster': 'gbtree', 'lambda': 0.07804323328332934, 'alpha': 0.09725112728991948, 'subsample': 0.8030221029648373, 'colsampe_bytree': 0.9983855799347479}. Best is trial 32 with value: 0.9375977256574272.\n",
      "[I 2024-11-11 22:43:08,171] Trial 41 finished with value: 0.936199952617863 and parameters: {'booster': 'gbtree', 'lambda': 0.6224218128115601, 'alpha': 0.21375859191898575, 'subsample': 0.9860074384586333, 'colsampe_bytree': 0.8249813636336271}. Best is trial 32 with value: 0.9375977256574272.\n",
      "[I 2024-11-11 22:43:08,382] Trial 42 finished with value: 0.9357735133854537 and parameters: {'booster': 'gbtree', 'lambda': 0.46291332696662374, 'alpha': 0.24378763778381535, 'subsample': 0.941735620644605, 'colsampe_bytree': 0.8943634421682052}. Best is trial 32 with value: 0.9375977256574272.\n",
      "[I 2024-11-11 22:43:08,594] Trial 43 finished with value: 0.9363657900971334 and parameters: {'booster': 'gbtree', 'lambda': 0.2659844045085306, 'alpha': 0.16312391608756774, 'subsample': 0.8718300193031919, 'colsampe_bytree': 0.8375592634995367}. Best is trial 32 with value: 0.9375977256574272.\n",
      "[I 2024-11-11 22:43:08,796] Trial 44 finished with value: 0.9248282397536128 and parameters: {'booster': 'gbtree', 'lambda': 0.6445204163432896, 'alpha': 0.35394260207360756, 'subsample': 0.9405384113595687, 'colsampe_bytree': 0.46398124258395174}. Best is trial 32 with value: 0.9375977256574272.\n",
      "/opt/conda/lib/python3.10/site-packages/xgboost/core.py:160: UserWarning: [22:43:08] WARNING: /workspace/src/learner.cc:742: \n",
      "Parameters: { \"colsample_bytree\", \"subsample\" } are not used.\n",
      "\n",
      "  warnings.warn(smsg, UserWarning)\n",
      "[I 2024-11-11 22:43:08,967] Trial 45 finished with value: 0.8171286425017769 and parameters: {'booster': 'gblinear', 'lambda': 0.2839204863129461, 'alpha': 0.13440448053242646, 'subsample': 0.7049701700537843, 'colsampe_bytree': 0.7475232343826806}. Best is trial 32 with value: 0.9375977256574272.\n",
      "[I 2024-11-11 22:43:09,190] Trial 46 finished with value: 0.9353470741530443 and parameters: {'booster': 'gbtree', 'lambda': 0.4679438668101361, 'alpha': 0.1993857134276593, 'subsample': 0.7862554268368117, 'colsampe_bytree': 0.6860226005710934}. Best is trial 32 with value: 0.9375977256574272.\n",
      "[I 2024-11-11 22:43:09,394] Trial 47 finished with value: 0.9135039090262971 and parameters: {'booster': 'gbtree', 'lambda': 0.9862367842925526, 'alpha': 0.5619709618279357, 'subsample': 0.7081176573835207, 'colsampe_bytree': 0.23994937170660935}. Best is trial 32 with value: 0.9375977256574272.\n",
      "[I 2024-11-11 22:43:09,602] Trial 48 finished with value: 0.9340677564558162 and parameters: {'booster': 'gbtree', 'lambda': 0.21405599876169212, 'alpha': 0.2911709766859403, 'subsample': 0.8568300888265754, 'colsampe_bytree': 0.5929908520366366}. Best is trial 32 with value: 0.9375977256574272.\n",
      "/opt/conda/lib/python3.10/site-packages/xgboost/core.py:160: UserWarning: [22:43:09] WARNING: /workspace/src/learner.cc:742: \n",
      "Parameters: { \"colsample_bytree\", \"subsample\" } are not used.\n",
      "\n",
      "  warnings.warn(smsg, UserWarning)\n",
      "[I 2024-11-11 22:43:09,771] Trial 49 finished with value: 0.8171286425017769 and parameters: {'booster': 'gblinear', 'lambda': 0.38976322639033945, 'alpha': 0.10033461998581292, 'subsample': 0.9421203383306568, 'colsampe_bytree': 0.8038000337119465}. Best is trial 32 with value: 0.9375977256574272.\n",
      "[I 2024-11-11 22:43:09,995] Trial 50 finished with value: 0.9356313669746505 and parameters: {'booster': 'gbtree', 'lambda': 0.11821741557679308, 'alpha': 0.3986243450067979, 'subsample': 0.6677273160903904, 'colsampe_bytree': 0.9543488460626598}. Best is trial 32 with value: 0.9375977256574272.\n",
      "[I 2024-11-11 22:43:10,209] Trial 51 finished with value: 0.9360341151385928 and parameters: {'booster': 'gbtree', 'lambda': 0.2672947716298206, 'alpha': 0.16172200166831982, 'subsample': 0.8417965080675073, 'colsampe_bytree': 0.8437497941532133}. Best is trial 32 with value: 0.9375977256574272.\n",
      "[I 2024-11-11 22:43:10,422] Trial 52 finished with value: 0.9360814972755271 and parameters: {'booster': 'gbtree', 'lambda': 0.18950650964752355, 'alpha': 0.23667151356187976, 'subsample': 0.9976339670762152, 'colsampe_bytree': 0.8428591847994864}. Best is trial 32 with value: 0.9375977256574272.\n",
      "[I 2024-11-11 22:43:10,631] Trial 53 finished with value: 0.9369817578772802 and parameters: {'booster': 'gbtree', 'lambda': 0.083493329213653, 'alpha': 0.1913710542294935, 'subsample': 0.9126369371347233, 'colsampe_bytree': 0.7927563828839477}. Best is trial 32 with value: 0.9375977256574272.\n",
      "[I 2024-11-11 22:43:10,843] Trial 54 finished with value: 0.9375740345889599 and parameters: {'booster': 'gbtree', 'lambda': 0.08560542910992232, 'alpha': 0.18003367835913467, 'subsample': 0.9056498915674176, 'colsampe_bytree': 0.7907512532546688}. Best is trial 32 with value: 0.9375977256574272.\n",
      "[I 2024-11-11 22:43:11,057] Trial 55 finished with value: 0.936697465055674 and parameters: {'booster': 'gbtree', 'lambda': 0.07963211910544024, 'alpha': 0.13507814268944332, 'subsample': 0.9109310123411626, 'colsampe_bytree': 0.7206371187853293}. Best is trial 32 with value: 0.9375977256574272.\n",
      "[I 2024-11-11 22:43:11,268] Trial 56 finished with value: 0.936199952617863 and parameters: {'booster': 'gbtree', 'lambda': 0.09310767802936576, 'alpha': 0.2828455375796168, 'subsample': 0.7786179619088879, 'colsampe_bytree': 0.7695949872359928}. Best is trial 32 with value: 0.9375977256574272.\n",
      "[I 2024-11-11 22:43:11,479] Trial 57 finished with value: 0.9365790097133381 and parameters: {'booster': 'gbtree', 'lambda': 0.04742751359884646, 'alpha': 0.1745792011310179, 'subsample': 0.7378015888125539, 'colsampe_bytree': 0.9014306166684387}. Best is trial 32 with value: 0.9375977256574272.\n",
      "[I 2024-11-11 22:43:11,863] Trial 58 finished with value: 0.9367685382610755 and parameters: {'booster': 'dart', 'lambda': 0.06212471910025184, 'alpha': 0.3406355197478129, 'subsample': 0.841890499740432, 'colsampe_bytree': 0.9460720401402684}. Best is trial 32 with value: 0.9375977256574272.\n",
      "[I 2024-11-11 22:43:12,253] Trial 59 finished with value: 0.9370528310826818 and parameters: {'booster': 'dart', 'lambda': 0.1369194434322607, 'alpha': 0.7275130869409204, 'subsample': 0.8142914470681555, 'colsampe_bytree': 0.9539702129217545}. Best is trial 32 with value: 0.9375977256574272.\n",
      "[I 2024-11-11 22:43:12,637] Trial 60 finished with value: 0.9364131722340677 and parameters: {'booster': 'dart', 'lambda': 0.1521037682524437, 'alpha': 0.9657473458705814, 'subsample': 0.5607085631629997, 'colsampe_bytree': 0.8752257804798093}. Best is trial 32 with value: 0.9375977256574272.\n",
      "[I 2024-11-11 22:43:13,081] Trial 61 finished with value: 0.9362236436863303 and parameters: {'booster': 'dart', 'lambda': 0.05770042965888716, 'alpha': 0.6842122687479582, 'subsample': 0.8620911979470764, 'colsampe_bytree': 0.9544218693062299}. Best is trial 32 with value: 0.9375977256574272.\n",
      "[I 2024-11-11 22:43:13,488] Trial 62 finished with value: 0.9357735133854537 and parameters: {'booster': 'dart', 'lambda': 0.1246057669407247, 'alpha': 0.7075622497130991, 'subsample': 0.9135942321653241, 'colsampe_bytree': 0.9717233732655886}. Best is trial 32 with value: 0.9375977256574272.\n",
      "[I 2024-11-11 22:43:13,873] Trial 63 finished with value: 0.9364605543710022 and parameters: {'booster': 'dart', 'lambda': 0.09729578174459576, 'alpha': 0.3451668247264069, 'subsample': 0.8031738759929578, 'colsampe_bytree': 0.7983675103816809}. Best is trial 32 with value: 0.9375977256574272.\n",
      "[I 2024-11-11 22:43:14,226] Trial 64 finished with value: 0.85939350864724 and parameters: {'booster': 'dart', 'lambda': 0.047211668458286206, 'alpha': 0.47910830659453696, 'subsample': 0.8281969966205387, 'colsampe_bytree': 0.07882651415420194}. Best is trial 32 with value: 0.9375977256574272.\n",
