{
 "cells": [
  {
   "cell_type": "code",
   "execution_count": 1,
   "id": "dea9d155",
   "metadata": {
    "_cell_guid": "b1076dfc-b9ad-4769-8c92-a6c4dae69d19",
    "_uuid": "8f2839f25d086af736a60e9eeb907d3b93b6e0e5",
    "execution": {
     "iopub.execute_input": "2024-11-11T22:42:36.060977Z",
     "iopub.status.busy": "2024-11-11T22:42:36.060439Z",
     "iopub.status.idle": "2024-11-11T22:42:37.910256Z",
     "shell.execute_reply": "2024-11-11T22:42:37.909026Z"
    },
    "papermill": {
     "duration": 1.859125,
     "end_time": "2024-11-11T22:42:37.912643",
     "exception": false,
     "start_time": "2024-11-11T22:42:36.053518",
     "status": "completed"
    },
    "tags": []
   },
   "outputs": [
    {
     "name": "stdout",
     "output_type": "stream",
     "text": [
      "/kaggle/input/playground-series-s4e11/sample_submission.csv\n",
      "/kaggle/input/playground-series-s4e11/train.csv\n",
      "/kaggle/input/playground-series-s4e11/test.csv\n"
     ]
    },
    {
     "data": {
      "text/html": [
       "<div>\n",
       "<style scoped>\n",
       "    .dataframe tbody tr th:only-of-type {\n",
       "        vertical-align: middle;\n",
       "    }\n",
       "\n",
       "    .dataframe tbody tr th {\n",
       "        vertical-align: top;\n",
       "    }\n",
       "\n",
       "    .dataframe thead th {\n",
       "        text-align: right;\n",
       "    }\n",
       "</style>\n",
       "<table border=\"1\" class=\"dataframe\">\n",
       "  <thead>\n",
       "    <tr style=\"text-align: right;\">\n",
       "      <th></th>\n",
       "      <th>id</th>\n",
       "      <th>Name</th>\n",
       "      <th>Gender</th>\n",
       "      <th>Age</th>\n",
       "      <th>City</th>\n",
       "      <th>Working Professional or Student</th>\n",
       "      <th>Profession</th>\n",
       "      <th>Academic Pressure</th>\n",
       "      <th>Work Pressure</th>\n",
       "      <th>CGPA</th>\n",
       "      <th>Study Satisfaction</th>\n",
       "      <th>Job Satisfaction</th>\n",
       "      <th>Sleep Duration</th>\n",
       "      <th>Dietary Habits</th>\n",
       "      <th>Degree</th>\n",
       "      <th>Have you ever had suicidal thoughts ?</th>\n",
       "      <th>Work/Study Hours</th>\n",
       "      <th>Financial Stress</th>\n",
       "      <th>Family History of Mental Illness</th>\n",
       "      <th>Depression</th>\n",
       "    </tr>\n",
       "  </thead>\n",
       "  <tbody>\n",
       "    <tr>\n",
       "      <th>0</th>\n",
       "      <td>0</td>\n",
       "      <td>Aaradhya</td>\n",
       "      <td>Female</td>\n",
       "      <td>49.0</td>\n",
       "      <td>Ludhiana</td>\n",
       "      <td>Working Professional</td>\n",
       "      <td>Chef</td>\n",
       "      <td>NaN</td>\n",
       "      <td>5.0</td>\n",
       "      <td>NaN</td>\n",
       "      <td>NaN</td>\n",
       "      <td>2.0</td>\n",
       "      <td>More than 8 hours</td>\n",
       "      <td>Healthy</td>\n",
       "      <td>BHM</td>\n",
       "      <td>No</td>\n",
       "      <td>1.0</td>\n",
       "      <td>2.0</td>\n",
       "      <td>No</td>\n",
       "      <td>0</td>\n",
       "    </tr>\n",
       "    <tr>\n",
       "      <th>1</th>\n",
       "      <td>1</td>\n",
       "      <td>Vivan</td>\n",
       "      <td>Male</td>\n",
       "      <td>26.0</td>\n",
       "      <td>Varanasi</td>\n",
       "      <td>Working Professional</td>\n",
       "      <td>Teacher</td>\n",
       "      <td>NaN</td>\n",
       "      <td>4.0</td>\n",
       "      <td>NaN</td>\n",
       "      <td>NaN</td>\n",
       "      <td>3.0</td>\n",
       "      <td>Less than 5 hours</td>\n",
       "      <td>Unhealthy</td>\n",
       "      <td>LLB</td>\n",
       "      <td>Yes</td>\n",
       "      <td>7.0</td>\n",
       "      <td>3.0</td>\n",
       "      <td>No</td>\n",
       "      <td>1</td>\n",
       "    </tr>\n",
       "    <tr>\n",
       "      <th>2</th>\n",
       "      <td>2</td>\n",
       "      <td>Yuvraj</td>\n",
       "      <td>Male</td>\n",
       "      <td>33.0</td>\n",
       "      <td>Visakhapatnam</td>\n",
       "      <td>Student</td>\n",
       "      <td>NaN</td>\n",
       "      <td>5.0</td>\n",
       "      <td>NaN</td>\n",
       "      <td>8.97</td>\n",
       "      <td>2.0</td>\n",
       "      <td>NaN</td>\n",
       "      <td>5-6 hours</td>\n",
       "      <td>Healthy</td>\n",
       "      <td>B.Pharm</td>\n",
       "      <td>Yes</td>\n",
       "      <td>3.0</td>\n",
       "      <td>1.0</td>\n",
       "      <td>No</td>\n",
       "      <td>1</td>\n",
       "    </tr>\n",
       "    <tr>\n",
       "      <th>3</th>\n",
       "      <td>3</td>\n",
       "      <td>Yuvraj</td>\n",
       "      <td>Male</td>\n",
       "      <td>22.0</td>\n",
       "      <td>Mumbai</td>\n",
       "      <td>Working Professional</td>\n",
       "      <td>Teacher</td>\n",
       "      <td>NaN</td>\n",
       "      <td>5.0</td>\n",
       "      <td>NaN</td>\n",
       "      <td>NaN</td>\n",
       "      <td>1.0</td>\n",
       "      <td>Less than 5 hours</td>\n",
       "      <td>Moderate</td>\n",
       "      <td>BBA</td>\n",
       "      <td>Yes</td>\n",
       "      <td>10.0</td>\n",
       "      <td>1.0</td>\n",
       "      <td>Yes</td>\n",
       "      <td>1</td>\n",
       "    </tr>\n",
       "    <tr>\n",
       "      <th>4</th>\n",
       "      <td>4</td>\n",
       "      <td>Rhea</td>\n",
       "      <td>Female</td>\n",
       "      <td>30.0</td>\n",
       "      <td>Kanpur</td>\n",
       "      <td>Working Professional</td>\n",
       "      <td>Business Analyst</td>\n",
       "      <td>NaN</td>\n",
       "      <td>1.0</td>\n",
       "      <td>NaN</td>\n",
       "      <td>NaN</td>\n",
       "      <td>1.0</td>\n",
       "      <td>5-6 hours</td>\n",
       "      <td>Unhealthy</td>\n",
       "      <td>BBA</td>\n",
       "      <td>Yes</td>\n",
       "      <td>9.0</td>\n",
       "      <td>4.0</td>\n",
       "      <td>Yes</td>\n",
       "      <td>0</td>\n",
       "    </tr>\n",
       "    <tr>\n",
       "      <th>...</th>\n",
       "      <td>...</td>\n",
       "      <td>...</td>\n",
       "      <td>...</td>\n",
       "      <td>...</td>\n",
       "      <td>...</td>\n",
       "      <td>...</td>\n",
       "      <td>...</td>\n",
       "      <td>...</td>\n",
       "      <td>...</td>\n",
       "      <td>...</td>\n",
       "      <td>...</td>\n",
       "      <td>...</td>\n",
       "      <td>...</td>\n",
       "      <td>...</td>\n",
       "      <td>...</td>\n",
       "      <td>...</td>\n",
       "      <td>...</td>\n",
       "      <td>...</td>\n",
       "      <td>...</td>\n",
       "      <td>...</td>\n",
       "    </tr>\n",
       "    <tr>\n",
       "      <th>140695</th>\n",
       "      <td>140695</td>\n",
       "      <td>Vidya</td>\n",
       "      <td>Female</td>\n",
       "      <td>18.0</td>\n",
       "      <td>Ahmedabad</td>\n",
       "      <td>Working Professional</td>\n",
       "      <td>NaN</td>\n",
       "      <td>NaN</td>\n",
       "      <td>5.0</td>\n",
       "      <td>NaN</td>\n",
       "      <td>NaN</td>\n",
       "      <td>4.0</td>\n",
       "      <td>5-6 hours</td>\n",
       "      <td>Unhealthy</td>\n",
       "      <td>Class 12</td>\n",
       "      <td>No</td>\n",
       "      <td>2.0</td>\n",
       "      <td>4.0</td>\n",
       "      <td>Yes</td>\n",
       "      <td>1</td>\n",
       "    </tr>\n",
       "    <tr>\n",
       "      <th>140696</th>\n",
       "      <td>140696</td>\n",
       "      <td>Lata</td>\n",
       "      <td>Female</td>\n",
       "      <td>41.0</td>\n",
       "      <td>Hyderabad</td>\n",
       "      <td>Working Professional</td>\n",
       "      <td>Content Writer</td>\n",
       "      <td>NaN</td>\n",
       "      <td>5.0</td>\n",
       "      <td>NaN</td>\n",
       "      <td>NaN</td>\n",
       "      <td>4.0</td>\n",
       "      <td>7-8 hours</td>\n",
       "      <td>Moderate</td>\n",
       "      <td>B.Tech</td>\n",
       "      <td>Yes</td>\n",
       "      <td>6.0</td>\n",
       "      <td>5.0</td>\n",
       "      <td>Yes</td>\n",
       "      <td>0</td>\n",
       "    </tr>\n",
       "    <tr>\n",
       "      <th>140697</th>\n",
       "      <td>140697</td>\n",
       "      <td>Aanchal</td>\n",
       "      <td>Female</td>\n",
       "      <td>24.0</td>\n",
       "      <td>Kolkata</td>\n",
       "      <td>Working Professional</td>\n",
       "      <td>Marketing Manager</td>\n",
       "      <td>NaN</td>\n",
       "      <td>3.0</td>\n",
       "      <td>NaN</td>\n",
       "      <td>NaN</td>\n",
       "      <td>1.0</td>\n",
       "      <td>More than 8 hours</td>\n",
       "      <td>Moderate</td>\n",
       "      <td>B.Com</td>\n",
       "      <td>No</td>\n",
       "      <td>4.0</td>\n",
       "      <td>4.0</td>\n",
       "      <td>No</td>\n",
       "      <td>0</td>\n",
       "    </tr>\n",
       "    <tr>\n",
       "      <th>140698</th>\n",
       "      <td>140698</td>\n",
       "      <td>Prachi</td>\n",
       "      <td>Female</td>\n",
       "      <td>49.0</td>\n",
       "      <td>Srinagar</td>\n",
       "      <td>Working Professional</td>\n",
       "      <td>Plumber</td>\n",
       "      <td>NaN</td>\n",
       "      <td>5.0</td>\n",
       "      <td>NaN</td>\n",
       "      <td>NaN</td>\n",
       "      <td>2.0</td>\n",
       "      <td>5-6 hours</td>\n",
       "      <td>Moderate</td>\n",
       "      <td>ME</td>\n",
       "      <td>Yes</td>\n",
       "      <td>10.0</td>\n",
       "      <td>1.0</td>\n",
       "      <td>No</td>\n",
       "      <td>0</td>\n",
       "    </tr>\n",
       "    <tr>\n",
       "      <th>140699</th>\n",
       "      <td>140699</td>\n",
       "      <td>Sai</td>\n",
       "      <td>Male</td>\n",
       "      <td>27.0</td>\n",
       "      <td>Patna</td>\n",
       "      <td>Student</td>\n",
       "      <td>NaN</td>\n",
       "      <td>4.0</td>\n",
       "      <td>NaN</td>\n",
       "      <td>9.24</td>\n",
       "      <td>1.0</td>\n",
       "      <td>NaN</td>\n",
       "      <td>Less than 5 hours</td>\n",
       "      <td>Healthy</td>\n",
       "      <td>BCA</td>\n",
       "      <td>Yes</td>\n",
       "      <td>2.0</td>\n",
       "      <td>3.0</td>\n",
       "      <td>Yes</td>\n",
       "      <td>1</td>\n",
       "    </tr>\n",
       "  </tbody>\n",
       "</table>\n",
       "<p>140700 rows × 20 columns</p>\n",
       "</div>"
      ],
      "text/plain": [
       "            id      Name  Gender   Age           City  \\\n",
       "0            0  Aaradhya  Female  49.0       Ludhiana   \n",
       "1            1     Vivan    Male  26.0       Varanasi   \n",
       "2            2    Yuvraj    Male  33.0  Visakhapatnam   \n",
       "3            3    Yuvraj    Male  22.0         Mumbai   \n",
       "4            4      Rhea  Female  30.0         Kanpur   \n",
       "...        ...       ...     ...   ...            ...   \n",
       "140695  140695     Vidya  Female  18.0      Ahmedabad   \n",
       "140696  140696      Lata  Female  41.0      Hyderabad   \n",
       "140697  140697   Aanchal  Female  24.0        Kolkata   \n",
       "140698  140698    Prachi  Female  49.0       Srinagar   \n",
       "140699  140699       Sai    Male  27.0          Patna   \n",
       "\n",
       "       Working Professional or Student         Profession  Academic Pressure  \\\n",
       "0                 Working Professional               Chef                NaN   \n",
       "1                 Working Professional            Teacher                NaN   \n",
       "2                              Student                NaN                5.0   \n",
       "3                 Working Professional            Teacher                NaN   \n",
       "4                 Working Professional   Business Analyst                NaN   \n",
       "...                                ...                ...                ...   \n",
       "140695            Working Professional                NaN                NaN   \n",
       "140696            Working Professional     Content Writer                NaN   \n",
       "140697            Working Professional  Marketing Manager                NaN   \n",
       "140698            Working Professional            Plumber                NaN   \n",
       "140699                         Student                NaN                4.0   \n",
       "\n",
       "        Work Pressure  CGPA  Study Satisfaction  Job Satisfaction  \\\n",
       "0                 5.0   NaN                 NaN               2.0   \n",
       "1                 4.0   NaN                 NaN               3.0   \n",
       "2                 NaN  8.97                 2.0               NaN   \n",
       "3                 5.0   NaN                 NaN               1.0   \n",
       "4                 1.0   NaN                 NaN               1.0   \n",
       "...               ...   ...                 ...               ...   \n",
       "140695            5.0   NaN                 NaN               4.0   \n",
       "140696            5.0   NaN                 NaN               4.0   \n",
       "140697            3.0   NaN                 NaN               1.0   \n",
       "140698            5.0   NaN                 NaN               2.0   \n",
       "140699            NaN  9.24                 1.0               NaN   \n",
       "\n",
       "           Sleep Duration Dietary Habits    Degree  \\\n",
       "0       More than 8 hours        Healthy       BHM   \n",
       "1       Less than 5 hours      Unhealthy       LLB   \n",
       "2               5-6 hours        Healthy   B.Pharm   \n",
       "3       Less than 5 hours       Moderate       BBA   \n",
       "4               5-6 hours      Unhealthy       BBA   \n",
       "...                   ...            ...       ...   \n",
       "140695          5-6 hours      Unhealthy  Class 12   \n",
       "140696          7-8 hours       Moderate    B.Tech   \n",
       "140697  More than 8 hours       Moderate     B.Com   \n",
       "140698          5-6 hours       Moderate        ME   \n",
       "140699  Less than 5 hours        Healthy       BCA   \n",
       "\n",
       "       Have you ever had suicidal thoughts ?  Work/Study Hours  \\\n",
       "0                                         No               1.0   \n",
       "1                                        Yes               7.0   \n",
       "2                                        Yes               3.0   \n",
       "3                                        Yes              10.0   \n",
       "4                                        Yes               9.0   \n",
       "...                                      ...               ...   \n",
       "140695                                    No               2.0   \n",
       "140696                                   Yes               6.0   \n",
       "140697                                    No               4.0   \n",
       "140698                                   Yes              10.0   \n",
       "140699                                   Yes               2.0   \n",
       "\n",
       "        Financial Stress Family History of Mental Illness  Depression  \n",
       "0                    2.0                               No           0  \n",
       "1                    3.0                               No           1  \n",
       "2                    1.0                               No           1  \n",
       "3                    1.0                              Yes           1  \n",
       "4                    4.0                              Yes           0  \n",
       "...                  ...                              ...         ...  \n",
       "140695               4.0                              Yes           1  \n",
       "140696               5.0                              Yes           0  \n",
       "140697               4.0                               No           0  \n",
       "140698               1.0                               No           0  \n",
       "140699               3.0                              Yes           1  \n",
       "\n",
       "[140700 rows x 20 columns]"
      ]
     },
     "execution_count": 1,
     "metadata": {},
     "output_type": "execute_result"
    }
   ],
   "source": [
    "import numpy as np # linear algebra\n",
    "import pandas as pd # data processing, CSV file I/O (e.g. pd.read_csv)\n",
    "\n",
    "import os\n",
    "for dirname, _, filenames in os.walk('/kaggle/input'):\n",
    "    for filename in filenames:\n",
    "        print(os.path.join(dirname, filename))\n",
    "        \n",
    "train = pd.read_csv('/kaggle/input/playground-series-s4e11/train.csv')\n",
    "test = pd.read_csv('/kaggle/input/playground-series-s4e11/test.csv')\n",
    "\n",
    "train"
   ]
  },
  {
   "cell_type": "markdown",
   "id": "86cb79b5",
   "metadata": {
    "papermill": {
     "duration": 0.004725,
     "end_time": "2024-11-11T22:42:37.922513",
     "exception": false,
     "start_time": "2024-11-11T22:42:37.917788",
     "status": "completed"
    },
    "tags": []
   },
   "source": [
    "# <center>Kaggle Playground: Predicting Loan Approval</center>"
   ]
  },
  {
   "cell_type": "markdown",
   "id": "81028242",
   "metadata": {
    "papermill": {
     "duration": 0.00454,
     "end_time": "2024-11-11T22:42:37.931918",
     "exception": false,
     "start_time": "2024-11-11T22:42:37.927378",
     "status": "completed"
    },
    "tags": []
   },
   "source": [
    "### <center>Your goal is to use data from a mental health survey to explore factors that may cause individuals to experience depression.</center>"
   ]
  },
  {
   "cell_type": "code",
   "execution_count": 2,
   "id": "3c1a1cf5",
   "metadata": {
    "execution": {
     "iopub.execute_input": "2024-11-11T22:42:37.943393Z",
     "iopub.status.busy": "2024-11-11T22:42:37.942983Z",
     "iopub.status.idle": "2024-11-11T22:42:37.951882Z",
     "shell.execute_reply": "2024-11-11T22:42:37.950755Z"
    },
    "papermill": {
     "duration": 0.017552,
     "end_time": "2024-11-11T22:42:37.954266",
     "exception": false,
     "start_time": "2024-11-11T22:42:37.936714",
     "status": "completed"
    },
    "tags": []
   },
   "outputs": [
    {
     "data": {
      "text/plain": [
       "id                                         int64\n",
       "Name                                      object\n",
       "Gender                                    object\n",
       "Age                                      float64\n",
       "City                                      object\n",
       "Working Professional or Student           object\n",
       "Profession                                object\n",
       "Academic Pressure                        float64\n",
       "Work Pressure                            float64\n",
       "CGPA                                     float64\n",
       "Study Satisfaction                       float64\n",
       "Job Satisfaction                         float64\n",
       "Sleep Duration                            object\n",
       "Dietary Habits                            object\n",
       "Degree                                    object\n",
       "Have you ever had suicidal thoughts ?     object\n",
       "Work/Study Hours                         float64\n",
       "Financial Stress                         float64\n",
       "Family History of Mental Illness          object\n",
       "Depression                                 int64\n",
       "dtype: object"
      ]
     },
     "execution_count": 2,
     "metadata": {},
     "output_type": "execute_result"
    }
   ],
   "source": [
    "train.dtypes"
   ]
  },
  {
   "cell_type": "code",
   "execution_count": 3,
   "id": "dee205af",
   "metadata": {
    "execution": {
     "iopub.execute_input": "2024-11-11T22:42:37.966755Z",
     "iopub.status.busy": "2024-11-11T22:42:37.965825Z",
     "iopub.status.idle": "2024-11-11T22:42:39.560912Z",
     "shell.execute_reply": "2024-11-11T22:42:39.559855Z"
    },
    "papermill": {
     "duration": 1.604137,
     "end_time": "2024-11-11T22:42:39.563584",
     "exception": false,
     "start_time": "2024-11-11T22:42:37.959447",
     "status": "completed"
    },
    "tags": []
   },
   "outputs": [],
   "source": [
    "from sklearn.model_selection import train_test_split\n",
    "\n",
    "X = train.drop(['Name', 'Depression', 'id'], axis=1)\n",
    "y = train['Depression']\n",
    "\n",
    "X_train, X_test, y_train, y_test = train_test_split(X, y, random_state=10, test_size=.3)"
   ]
  },
  {
   "cell_type": "code",
   "execution_count": 4,
   "id": "1b4e3365",
   "metadata": {
    "execution": {
     "iopub.execute_input": "2024-11-11T22:42:39.575832Z",
     "iopub.status.busy": "2024-11-11T22:42:39.575287Z",
     "iopub.status.idle": "2024-11-11T22:42:40.795678Z",
     "shell.execute_reply": "2024-11-11T22:42:40.794699Z"
    },
    "papermill": {
     "duration": 1.22913,
     "end_time": "2024-11-11T22:42:40.797868",
     "exception": false,
     "start_time": "2024-11-11T22:42:39.568738",
     "status": "completed"
    },
    "tags": []
   },
   "outputs": [
    {
     "data": {
      "text/plain": [
       "array([[-1.93863243e-01, -4.25971150e-02, -8.07451397e-06, ...,\n",
       "         6.70000000e+01,  0.00000000e+00,  1.00000000e+00],\n",
       "       [-1.40581620e+00, -4.25971150e-02,  1.59050965e+00, ...,\n",
       "         1.60000000e+01,  1.00000000e+00,  0.00000000e+00],\n",
       "       [ 1.58366764e+00, -4.25971150e-02, -8.07451397e-06, ...,\n",
       "         6.00000000e+01,  0.00000000e+00,  0.00000000e+00],\n",
       "       ...,\n",
       "       [ 1.01