      "[I 2024-11-11 22:43:14,615] Trial 65 finished with value: 0.9358682776593225 and parameters: {'booster': 'dart', 'lambda': 0.06491099489236969, 'alpha': 0.25302633113754164, 'subsample': 0.9662361331245656, 'colsampe_bytree': 0.9351260134344404}. Best is trial 32 with value: 0.9375977256574272.\n",
      "[I 2024-11-11 22:43:15,004] Trial 66 finished with value: 0.9366027007818053 and parameters: {'booster': 'dart', 'lambda': 0.022008535574011483, 'alpha': 0.13794852070133778, 'subsample': 0.7788278861852366, 'colsampe_bytree': 0.8713091398947537}. Best is trial 32 with value: 0.9375977256574272.\n",
      "[I 2024-11-11 22:43:15,389] Trial 67 finished with value: 0.9177683013503909 and parameters: {'booster': 'dart', 'lambda': 0.08083725984791286, 'alpha': 0.31590390383499967, 'subsample': 0.9033485456961543, 'colsampe_bytree': 0.30441567487298626}. Best is trial 32 with value: 0.9375977256574272.\n",
      "[I 2024-11-11 22:43:15,775] Trial 68 finished with value: 0.9360341151385928 and parameters: {'booster': 'dart', 'lambda': 0.10864064021351379, 'alpha': 0.42168648256903635, 'subsample': 0.8440512554276068, 'colsampe_bytree': 0.7421142200683494}. Best is trial 32 with value: 0.9375977256574272.\n",
      "[I 2024-11-11 22:43:16,164] Trial 69 finished with value: 0.9359867330016584 and parameters: {'booster': 'dart', 'lambda': 0.14918341792567863, 'alpha': 0.10572210809316133, 'subsample': 0.6833663014564858, 'colsampe_bytree': 0.8999286587105126}. Best is trial 32 with value: 0.9375977256574272.\n",
      "/opt/conda/lib/python3.10/site-packages/xgboost/core.py:160: UserWarning: [22:43:16] WARNING: /workspace/src/learner.cc:742: \n",
      "Parameters: { \"colsample_bytree\", \"subsample\" } are not used.\n",
      "\n",
      "  warnings.warn(smsg, UserWarning)\n",
      "[I 2024-11-11 22:43:16,336] Trial 70 finished with value: 0.8171286425017769 and parameters: {'booster': 'gblinear', 'lambda': 0.041572474353545046, 'alpha': 0.18660073363453314, 'subsample': 0.8816580265382086, 'colsampe_bytree': 0.977399166961511}. Best is trial 32 with value: 0.9375977256574272.\n",
      "[I 2024-11-11 22:43:16,560] Trial 71 finished with value: 0.9362473347547975 and parameters: {'booster': 'gbtree', 'lambda': 0.07898065313065489, 'alpha': 0.20794336846108166, 'subsample': 0.7250467675213924, 'colsampe_bytree': 0.9182696416089328}. Best is trial 32 with value: 0.9375977256574272.\n",
      "[I 2024-11-11 22:43:16,776] Trial 72 finished with value: 0.9352286188107084 and parameters: {'booster': 'gbtree', 'lambda': 0.05503358768016381, 'alpha': 0.08117511343676957, 'subsample': 0.8087598341526482, 'colsampe_bytree': 0.9466099571252693}. Best is trial 32 with value: 0.9375977256574272.\n",
      "[I 2024-11-11 22:43:16,988] Trial 73 finished with value: 0.9355129116323146 and parameters: {'booster': 'gbtree', 'lambda': 0.3858758228502953, 'alpha': 0.26663740417076864, 'subsample': 0.7720022314231791, 'colsampe_bytree': 0.8711103450310256}. Best is trial 32 with value: 0.9375977256574272.\n",
      "[I 2024-11-11 22:43:17,203] Trial 74 finished with value: 0.9361288794124615 and parameters: {'booster': 'gbtree', 'lambda': 0.06931550317506156, 'alpha': 0.14708115228374713, 'subsample': 0.9668618991850126, 'colsampe_bytree': 0.9969370579845156}. Best is trial 32 with value: 0.9375977256574272.\n",
      "[I 2024-11-11 22:43:17,417] Trial 75 finished with value: 0.9357261312485193 and parameters: {'booster': 'gbtree', 'lambda': 0.08901017734519086, 'alpha': 0.18039265777865998, 'subsample': 0.8535074991370255, 'colsampe_bytree': 0.7815453017399338}. Best is trial 32 with value: 0.9375977256574272.\n",
      "[I 2024-11-11 22:43:17,630] Trial 76 finished with value: 0.9358682776593225 and parameters: {'booster': 'gbtree', 'lambda': 0.014029387614459527, 'alpha': 0.12106307792450322, 'subsample': 0.9223534682783172, 'colsampe_bytree': 0.9184785327260799}. Best is trial 32 with value: 0.9375977256574272.\n",
      "[I 2024-11-11 22:43:18,017] Trial 77 finished with value: 0.935939350864724 and parameters: {'booster': 'dart', 'lambda': 0.07018624223079746, 'alpha': 0.31447231389109787, 'subsample': 0.7543062805874488, 'colsampe_bytree': 0.8536828902430149}. Best is trial 32 with value: 0.9375977256574272.\n",
      "[I 2024-11-11 22:43:18,233] Trial 78 finished with value: 0.9357261312485193 and parameters: {'booster': 'gbtree', 'lambda': 0.30602879295043345, 'alpha': 0.2349952239430261, 'subsample': 0.8888112387053448, 'colsampe_bytree': 0.9624941698715426}. Best is trial 32 with value: 0.9375977256574272.\n",
      "[I 2024-11-11 22:43:18,449] Trial 79 finished with value: 0.9362473347547975 and parameters: {'booster': 'gbtree', 'lambda': 0.02893182771938521, 'alpha': 0.05257459799701981, 'subsample': 0.6295494870354796, 'colsampe_bytree': 0.8199295753961802}. Best is trial 32 with value: 0.9375977256574272.\n",
      "[I 2024-11-11 22:43:18,657] Trial 80 finished with value: 0.9345652688936271 and parameters: {'booster': 'gbtree', 'lambda': 0.5301617514826724, 'alpha': 0.7007775216078858, 'subsample': 0.8234985206171574, 'colsampe_bytree': 0.6089262684330152}. Best is trial 32 with value: 0.9375977256574272.\n",
      "[I 2024-11-11 22:43:18,869] Trial 81 finished with value: 0.9356076759061833 and parameters: {'booster': 'gbtree', 'lambda': 0.08633335671751513, 'alpha': 0.12811106747523915, 'subsample': 0.9211084329507144, 'colsampe_bytree': 0.7391184384786093}. Best is trial 32 with value: 0.9375977256574272.\n",
      "[I 2024-11-11 22:43:19,087] Trial 82 finished with value: 0.9361288794124615 and parameters: {'booster': 'gbtree', 'lambda': 0.07246509467922739, 'alpha': 0.2090743259963601, 'subsample': 0.881594763004857, 'colsampe_bytree': 0.7084931000341821}. Best is trial 32 with value: 0.9375977256574272.\n",
      "[I 2024-11-11 22:43:19,299] Trial 83 finished with value: 0.9352523098791755 and parameters: {'booster': 'gbtree', 'lambda': 0.06178436585590071, 'alpha': 0.14825455934912246, 'subsample': 0.7941969066642376, 'colsampe_bytree': 0.6726360226662866}. Best is trial 32 with value: 0.9375977256574272.\n",
      "[I 2024-11-11 22:43:19,514] Trial 84 finished with value: 0.935820895522388 and parameters: {'booster': 'gbtree', 'lambda': 0.12862470051906644, 'alpha': 0.09020847952014963, 'subsample': 0.9626682348737162, 'colsampe_bytree': 0.8980699434371192}. Best is trial 32 with value: 0.9375977256574272.\n",
      "[I 2024-11-11 22:43:19,728] Trial 85 finished with value: 0.9328595119639895 and parameters: {'booster': 'gbtree', 'lambda': 0.10466929402210652, 'alpha': 0.1715450371374709, 'subsample': 0.4982009164445572, 'colsampe_bytree': 0.4971199710650367}. Best is trial 32 with value: 0.9375977256574272.\n",
      "/opt/conda/lib/python3.10/site-packages/xgboost/core.py:160: UserWarning: [22:43:19] WARNING: /workspace/src/learner.cc:742: \n",
      "Parameters: { \"colsample_bytree\", \"subsample\" } are not used.\n",
      "\n",
      "  warnings.warn(smsg, UserWarning)\n",
      "[I 2024-11-11 22:43:19,901] Trial 86 finished with value: 0.8171286425017769 and parameters: {'booster': 'gblinear', 'lambda': 0.1627558483623754, 'alpha': 0.19259963552468606, 'subsample': 0.9231836882702207, 'colsampe_bytree': 0.7960160137594203}. Best is trial 32 with value: 0.9375977256574272.\n",
      "[I 2024-11-11 22:43:20,133] Trial 87 finished with value: 0.9354655294953802 and parameters: {'booster': 'gbtree', 'lambda': 0.20613147488824676, 'alpha': 0.1099952217715659, 'subsample': 0.857238014949768, 'colsampe_bytree': 0.6641182691684404}. Best is trial 32 with value: 0.9375977256574272.\n",
      "[I 2024-11-11 22:43:20,353] Trial 88 finished with value: 0.9360578062070599 and parameters: {'booster': 'gbtree', 'lambda': 0.05290754475966078, 'alpha': 0.2217159333839421, 'subsample': 0.730463598327743, 'colsampe_bytree': 0.9313567761506678}. Best is trial 32 with value: 0.9375977256574272.\n",
      "[I 2024-11-11 22:43:20,738] Trial 89 finished with value: 0.9366263918502724 and parameters: {'booster': 'dart', 'lambda': 0.4223520918058352, 'alpha': 0.1360716055455312, 'subsample': 0.9033486730707349, 'colsampe_bytree': 0.8782619786453018}. Best is trial 32 with value: 0.9375977256574272.\n",
      "[I 2024-11-11 22:43:20,952] Trial 90 finished with value: 0.9358919687277896 and parameters: {'booster': 'gbtree', 'lambda': 0.04359969863101108, 'alpha': 0.11686328187507578, 'subsample': 0.8270589016718535, 'colsampe_bytree': 0.8265928909635899}. Best is trial 32 with value: 0.9375977256574272.\n",
      "[I 2024-11-11 22:43:21,340] Trial 91 finished with value: 0.9361525704809287 and parameters: {'booster': 'dart', 'lambda': 0.3659158030845589, 'alpha': 0.1442490695312292, 'subsample': 0.8981923628255618, 'colsampe_bytree': 0.883057495732654}. Best is trial 32 with value: 0.9375977256574272.\n",
      "[I 2024-11-11 22:43:21,729] Trial 92 finished with value: 0.9367211561241412 and parameters: {'booster': 'dart', 'lambda': 0.3033881171536074, 'alpha': 0.1625524551183757, 'subsample': 0.9848832237034412, 'colsampe_bytree': 0.8573234202601845}. Best is trial 32 with value: 0.9375977256574272.\n",
      "[I 2024-11-11 22:43:22,119] Trial 93 finished with value: 0.9358682776593225 and parameters: {'booster': 'dart', 'lambda': 0.25200885356624825, 'alpha': 0.1662277375632634, 'subsample': 0.9863722924866651, 'colsampe_bytree': 0.8527482023000905}. Best is trial 32 with value: 0.9375977256574272.\n",
      "[I 2024-11-11 22:43:22,508] Trial 94 finished with value: 0.9360578062070599 and parameters: {'booster': 'dart', 'lambda': 0.2956974512603582, 'alpha': 0.1905614397489394, 'subsample': 0.9995544033475046, 'colsampe_bytree': 0.7558019376154307}. Best is trial 32 with value: 0.9375977256574272.\n",
      "[I 2024-11-11 22:43:22,904] Trial 95 finished with value: 0.9371475953565506 and parameters: {'booster': 'dart', 'lambda': 0.7173061377067305, 'alpha': 0.2511316751723405, 'subsample': 0.9485196207137923, 'colsampe_bytree': 0.7889878600523345}. Best is trial 32 with value: 0.9375977256574272.\n",
      "[I 2024-11-11 22:43:23,374] Trial 96 finished with value: 0.9363657900971334 and parameters: {'booster': 'dart', 'lambda': 0.32787257868298514, 'alpha': 0.25739105561054093, 'subsample': 0.9415001139502648, 'colsampe_bytree': 0.9093812568293349}. Best is trial 32 with value: 0.9375977256574272.\n",
      "[I 2024-11-11 22:43:23,761] Trial 97 finished with value: 0.9365316275764037 and parameters: {'booster': 'dart', 'lambda': 0.7710967292690998, 'alpha': 0.39192968853045906, 'subsample': 0.968382596183724, 'colsampe_bytree': 0.9703599640820849}. Best is trial 32 with value: 0.9375977256574272.\n",
      "[I 2024-11-11 22:43:24,156] Trial 98 finished with value: 0.9366500829187396 and parameters: {'booster': 'dart', 'lambda': 0.6774062755396312, 'alpha': 0.22700432325294548, 'subsample': 0.8652835475547697, 'colsampe_bytree': 0.7815361970305145}. Best is trial 32 with value: 0.9375977256574272.\n",
