      "[I 2024-11-11 22:43:24,548] Trial 99 finished with value: 0.9360814972755271 and parameters: {'booster': 'dart', 'lambda': 0.5449324792789351, 'alpha': 0.5840666267958389, 'subsample': 0.7610877808447717, 'colsampe_bytree': 0.8118989263082399}. Best is trial 32 with value: 0.9375977256574272.\n"
     ]
    }
   ],
   "source": [
    "import optuna\n",
    "import xgboost as xgb\n",
    "\n",
    "def objective(trial):\n",
    "\n",
    "    dtrain = xgb.DMatrix(X_train_preprocessed, label=y_train)\n",
    "    dvalid = xgb.DMatrix(X_test_preprocessed, label=y_test)\n",
    "    \n",
    "    param = {\n",
    "        'objective': 'binary:logistic',\n",
    "        'booster': trial.suggest_categorical('booster', ['gbtree', 'gblinear', 'dart']),\n",
    "        'lambda': trial.suggest_float('lambda', 1e-2, 1.0, log=True),\n",
    "        'alpha': trial.suggest_float('alpha', 1e-2, 1.0, log=True),\n",
    "        'subsample': trial.suggest_float('subsample', 1e-2, 1.0),\n",
    "        'colsample_bytree': trial.suggest_float('colsampe_bytree', 1e-2, 1.0),\n",
    "    }\n",
    "\n",
    "    bst = xgb.train(param, dtrain)\n",
    "    preds = bst.predict(dvalid)\n",
    "    pred_labels = np.rint(preds)\n",
    "    accuracy = accuracy_score(y_test, pred_labels)\n",
    "\n",
    "    return accuracy\n",
    "\n",
    "study = optuna.create_study(direction='maximize')\n",
    "study.optimize(objective, n_trials=100)"
   ]
  },
  {
   "cell_type": "code",
   "execution_count": 10,
   "id": "5031d155",
   "metadata": {
    "execution": {
     "iopub.execute_input": "2024-11-11T22:43:24.675155Z",
     "iopub.status.busy": "2024-11-11T22:43:24.674725Z",
     "iopub.status.idle": "2024-11-11T22:43:35.160937Z",
     "shell.execute_reply": "2024-11-11T22:43:35.159730Z"
    },
    "papermill": {
     "duration": 10.547974,
     "end_time": "2024-11-11T22:43:35.163203",
     "exception": false,
     "start_time": "2024-11-11T22:43:24.615229",
     "status": "completed"
    },
    "tags": []
   },
   "outputs": [
    {
     "name": "stderr",
     "output_type": "stream",
     "text": [
      "/opt/conda/lib/python3.10/site-packages/xgboost/sklearn.py:889: UserWarning: `early_stopping_rounds` in `fit` method is deprecated for better compatibility with scikit-learn, use `early_stopping_rounds` in constructor or`set_params` instead.\n",
      "  warnings.warn(\n"
     ]
    },
    {
     "name": "stdout",
     "output_type": "stream",
     "text": [
      "[0]\tvalidation_0-logloss:0.45536\n",
      "[1]\tvalidation_0-logloss:0.43432\n",
      "[2]\tvalidation_0-logloss:0.41591\n",
      "[3]\tvalidation_0-logloss:0.39961\n",
      "[4]\tvalidation_0-logloss:0.38500\n",
      "[5]\tvalidation_0-logloss:0.37173\n",
      "[6]\tvalidation_0-logloss:0.35967\n",
      "[7]\tvalidation_0-logloss:0.34871\n",
      "[8]\tvalidation_0-logloss:0.33862\n",
      "[9]\tvalidation_0-logloss:0.32940\n",
      "[10]\tvalidation_0-logloss:0.32094\n",
      "[11]\tvalidation_0-logloss:0.31298\n",
      "[12]\tvalidation_0-logloss:0.30562\n",
      "[13]\tvalidation_0-logloss:0.29887\n",
      "[14]\tvalidation_0-logloss:0.29239\n",
      "[15]\tvalidation_0-logloss:0.28648\n",
      "[16]\tvalidation_0-logloss:0.28099\n",
      "[17]\tvalidation_0-logloss:0.27564\n",
      "[18]\tvalidation_0-logloss:0.27085\n",
      "[19]\tvalidation_0-logloss:0.26619\n",
      "[20]\tvalidation_0-logloss:0.26194\n",
      "[21]\tvalidation_0-logloss:0.25775\n",
      "[22]\tvalidation_0-logloss:0.25400\n",
      "[23]\tvalidation_0-logloss:0.25038\n",
      "[24]\tvalidation_0-logloss:0.24686\n",
      "[25]\tvalidation_0-logloss:0.24371\n",
      "[26]\tvalidation_0-logloss:0.24062\n",
      "[27]\tvalidation_0-logloss:0.23769\n",
      "[28]\tvalidation_0-logloss:0.23496\n",
      "[29]\tvalidation_0-logloss:0.23237\n",
      "[30]\tvalidation_0-logloss:0.22940\n",
      "[31]\tvalidation_0-logloss:0.22710\n",
      "[32]\tvalidation_0-logloss:0.22449\n",
      "[33]\tvalidation_0-logloss:0.22236\n",
      "[34]\tvalidation_0-logloss:0.22034\n",
      "[35]\tvalidation_0-logloss:0.21807\n",
      "[36]\tvalidation_0-logloss:0.21624\n",
      "[37]\tvalidation_0-logloss:0.21445\n",
      "[38]\tvalidation_0-logloss:0.21244\n",
      "[39]\tvalidation_0-logloss:0.21083\n",
      "[40]\tvalidation_0-logloss:0.20925\n",
      "[41]\tvalidation_0-logloss:0.20777\n",
      "[42]\tvalidation_0-logloss:0.20639\n",
      "[43]\tvalidation_0-logloss:0.20468\n",
      "[44]\tvalidation_0-logloss:0.20337\n",
      "[45]\tvalidation_0-logloss:0.20183\n",
      "[46]\tvalidation_0-logloss:0.20034\n",
      "[47]\tvalidation_0-logloss:0.19912\n",
      "[48]\tvalidation_0-logloss:0.19796\n",
      "[49]\tvalidation_0-logloss:0.19687\n",
      "[50]\tvalidation_0-logloss:0.19580\n",
      "[51]\tvalidation_0-logloss:0.19476\n",
      "[52]\tvalidation_0-logloss:0.19380\n",
      "[53]\tvalidation_0-logloss:0.19286\n",
      "[54]\tvalidation_0-logloss:0.19187\n",
      "[55]\tvalidation_0-logloss:0.19087\n",
      "[56]\tvalidation_0-logloss:0.19000\n",
      "[57]\tvalidation_0-logloss:0.18908\n",
      "[58]\tvalidation_0-logloss:0.18823\n",
      "[59]\tvalidation_0-logloss:0.18746\n",
      "[60]\tvalidation_0-logloss:0.18669\n",
      "[61]\tvalidation_0-logloss:0.18589\n",
      "[62]\tvalidation_0-logloss:0.18516\n",
      "[63]\tvalidation_0-logloss:0.18435\n",
      "[64]\tvalidation_0-logloss:0.18368\n",
      "[65]\tvalidation_0-logloss:0.18303\n",
      "[66]\tvalidation_0-logloss:0.18239\n",
      "[67]\tvalidation_0-logloss:0.18172\n",
      "[68]\tvalidation_0-logloss:0.18113\n",
      "[69]\tvalidation_0-logloss:0.18050\n",
      "[70]\tvalidation_0-logloss:0.17988\n",
      "[71]\tvalidation_0-logloss:0.17928\n",
      "[72]\tvalidation_0-logloss:0.17873\n",
      "[73]\tvalidation_0-logloss:0.17819\n",
      "[74]\tvalidation_0-logloss:0.17765\n",
      "[75]\tvalidation_0-logloss:0.17714\n",
      "[76]\tvalidation_0-logloss:0.17664\n",
      "[77]\tvalidation_0-logloss:0.17609\n",
      "[78]\tvalidation_0-logloss:0.17560\n",
      "[79]\tvalidation_0-logloss:0.17515\n",
      "[80]\tvalidation_0-logloss:0.17472\n",
      "[81]\tvalidation_0-logloss:0.17423\n",
      "[82]\tvalidation_0-logloss:0.17374\n",
      "[83]\tvalidation_0-logloss:0.17331\n",
      "[84]\tvalidation_0-logloss:0.17289\n",
      "[85]\tvalidation_0-logloss:0.17249\n",
      "[86]\tvalidation_0-logloss:0.17209\n",
      "[87]\tvalidation_0-logloss:0.17172\n",
      "[88]\tvalidation_0-logloss:0.17136\n",
      "[89]\tvalidation_0-logloss:0.17090\n",
      "[90]\tvalidation_0-logloss:0.17055\n",
      "[91]\tvalidation_0-logloss:0.17021\n",
      "[92]\tvalidation_0-logloss:0.16991\n",
      "[93]\tvalidation_0-logloss:0.16957\n",
      "[94]\tvalidation_0-logloss:0.16926\n",
      "[95]\tvalidation_0-logloss:0.16896\n",
      "[96]\tvalidation_0-logloss:0.16866\n",
      "[97]\tvalidation_0-logloss:0.16829\n",
      "[98]\tvalidation_0-logloss:0.16800\n",
      "[99]\tvalidation_0-logloss:0.16772\n",
      "[100]\tvalidation_0-logloss:0.16739\n",
      "[101]\tvalidation_0-logloss:0.16712\n",
      "[102]\tvalidation_0-logloss:0.16677\n",
      "[103]\tvalidation_0-logloss:0.16648\n",
      "[104]\tvalidation_0-logloss:0.16624\n",
      "[105]\tvalidation_0-logloss:0.16597\n",
      "[106]\tvalidation_0-logloss:0.16575\n",
      "[107]\tvalidation_0-logloss:0.16544\n",
      "[108]\tvalidation_0-logloss:0.16519\n",
      "[109]\tvalidation_0-logloss:0.16498\n",
      "[110]\tvalidation_0-logloss:0.16475\n",
      "[111]\tvalidation_0-logloss:0.16453\n",
      "[112]\tvalidation_0-logloss:0.16431\n",
      "[113]\tvalidation_0-logloss:0.16409\n",
      "[114]\tvalidation_0-logloss:0.16389\n",
      "[115]\tvalidation_0-logloss:0.16368\n",
      "[116]\tvalidation_0-logloss:0.16344\n",
      "[117]\tvalidation_0-logloss:0.16323\n",
      "[118]\tvalidation_0-logloss:0.16304\n",
      "[119]\tvalidation_0-logloss:0.16286\n",
      "[120]\tvalidation_0-logloss:0.16268\n",
      "[121]\tvalidation_0-logloss:0.16247\n",
      "[122]\tvalidation_0-logloss:0.16228\n",
      "[123]\tvalidation_0-logloss:0.16213\n",
      "[124]\tvalidation_0-logloss:0.16195\n",
      "[125]\tvalidation_0-logloss:0.16177\n",
      "[126]\tvalidation_0-logloss:0.16160\n",
      "[127]\tvalidation_0-logloss:0.16141\n",
      "[128]\tvalidation_0-logloss:0.16123\n",
      "[129]\tvalidation_0-logloss:0.16101\n",
      "[130]\tvalidation_0-logloss:0.16088\n",
      "[131]\tvalidation_0-logloss:0.16070\n",
      "[132]\tvalidation_0-logloss:0.16053\n",
      "[133]\tvalidation_0-logloss:0.16034\n",
      "[134]\tvalidation_0-logloss:0.16021\n",
      "[135]\tvalidation_0-logloss:0.16005\n",
      "[136]\tvalidation_0-logloss:0.15993\n",
      "[137]\tvalidation_0-logloss:0.15979\n",
      "[138]\tvalidation_0-logloss:0.15967\n",
      "[139]\tvalidation_0-logloss:0.15953\n",
      "[140]\tvalidation_0-logloss:0.15938\n",
      "[141]\tvalidation_0-logloss:0.15924\n",
      "[142]\tvalidation_0-logloss:0.15910\n",
      "[143]\tvalidation_0-logloss:0.15896\n",
      "[144]\tvalidation_0-logloss:0.15882\n",
      "[145]\tvalidation_0-logloss:0.15872\n",
      "[146]\tvalidation_0-logloss:0.15860\n",
      "[147]\tvalidation_0-logloss:0.15843\n",
      "[148]\tvalidation_0-logloss:0.15832\n",
      "[149]\tvalidation_0-logloss:0.15818\n",
      "[150]\tvalidation_0-logloss:0.15808\n",
      "[151]\tvalidation_0-logloss:0.15793\n",
      "[152]\tvalidation_0-logloss:0.15782\n",
      "[153]\tvalidation_0-logloss:0.15772\n",
      "[154]\tvalidation_0-logloss:0.15761\n",
      "[155]\tvalidation_0-logloss:0.15750\n",
      "[156]\tvalidation_0-logloss:0.15741\n",
      "[157]\tvalidation_0-logloss:0.15731\n",
      "[158]\tvalidation_0-logloss:0.15721\n",
      "[159]\tvalidation_0-logloss:0.15714\n",
      "[160]\tvalidation_0-logloss:0.15705\n",
      "[161]\tvalidation_0-logloss:0.15696\n",
      "[162]\tvalidation_0-logloss:0.15688\n",
      "[163]\tvalidation_0-logloss:0.15679\n",
      "[164]\tvalidation_0-logloss:0.15670\n",
      "[165]\tvalidation_0-logloss:0.15662\n",
      "[166]\tvalidation_0-logloss:0.15650\n",
      "[167]\tvalidation_0-logloss:0.15639\n",
      "[168]\tvalidation_0-logloss:0.15630\n",
      "[169]\tvalidation_0-logloss:0.15622\n",
      "[170]\tvalidation_0-logloss:0.15612\n",
      "[171]\tvalidation_0-logloss:0.15602\n",
      "[172]\tvalidation_0-logloss:0.15594\n",
      "[173]\tvalidation_0-logloss:0.15587\n",
      "[174]\tvalidation_0-logloss:0.15576\n",
      "[175]\tvalidation_0-logloss:0.15564\n",
      "[176]\tvalidation_0-logloss:0.15557\n",
      "[177]\tvalidation_0-logloss:0.15549\n",
      "[178]\tvalidation_0-logloss:0.15543\n",
      "[179]\tvalidation_0-logloss:0.15536\n",
      "[180]\tvalidation_0-logloss:0.15527\n",
      "[181]\tvalidation_0-logloss:0.15520\n",
      "[182]\tvalidation_0-logloss:0.15512\n",
      "[183]\tvalidation_0-logloss:0.15506\n",
      "[184]\tvalidation_0-logloss:0.15502\n",
      "[185]\tvalidation_0-logloss:0.15496\n",
      "[186]\tvalidation_0-logloss:0.15490\n",
      "[187]\tvalidation_0-logloss:0.15484\n",
      "[188]\tvalidation_0-logloss:0.15478\n",
      "[189]\tvalidation_0-logloss:0.15474\n",
      "[190]\tvalidation_0-logloss:0.15466\n",
      "[191]\tvalidation_0-logloss:0.15461\n",
      "[192]\tvalidation_0-logloss:0.15455\n",
      "[193]\tvalidation_0-logloss:0.15449\n",
      "[194]\tvalidation_0-logloss:0.15445\n",
      "[195]\tvalidation_0-logloss:0.15438\n",
      "[196]\tvalidation_0-logloss:0.15434\n",
      "[197]\tvalidation_0-logloss:0.15427\n",
      "[198]\tvalidation_0-logloss:0.15423\n",
      "[199]\tvalidation_0-logloss:0.15417\n",
      "[200]\tvalidation_0-logloss:0.15410\n",
      "[201]\tvalidation_0-logloss:0.15407\n",
      "[202]\tvalidation_0-logloss:0.15402\n",
      "[203]\tvalidation_0-logloss:0.15395\n",
      "[204]\tvalidation_0-logloss:0.15392\n",
      "[205]\tvalidation_0-logloss:0.15385\n",
      "[206]\tvalidation_0-logloss:0.15379\n",
      "[207]\tvalidation_0-logloss:0.15371\n",
      "[208]\tvalidation_0-logloss:0.15364\n",
      "[209]\tvalidation_0-logloss:0.15360\n",
      "[210]\tvalidation_0-logloss:0.15355\n",
      "[211]\tvalidation_0-logloss:0.15352\n",
      "[212]\tvalidation_0-logloss:0.15348\n",
      "[213]\tvalidation_0-logloss:0.15344\n",
      "[214]\tvalidation_0-logloss:0.15339\n",
      "[215]\tvalidation_0-logloss:0.15334\n",
      "[216]\tvalidation_0-logloss:0.15330\n",
      "[217]\tvalidation_0-logloss:0.15322\n",
      "[218]\tvalidation_0-logloss:0.15315\n",
      "[219]\tvalidation_0-logloss:0.15310\n",
      "[220]\tvalidation_0-logloss:0.15306\n",
      "[221]\tvalidation_0-logloss:0.15302\n",
      "[222]\tvalidation_0-logloss:0.15299\n",
      "[223]\tvalidation_0-logloss:0.15296\n",
      "[224]\tvalidation_0-logloss:0.15293\n",
      "[225]\tvalidation_0-logloss:0.15289\n",
      "[226]\tvalidation_0-logloss:0.15285\n",
      "[227]\tvalidation_0-logloss:0.15281\n",
      "[228]\tvalidation_0-logloss:0.15277\n",
      "[229]\tvalidation_0-logloss:0.15270\n",
      "[230]\tvalidation_0-logloss:0.15267\n",
      "[231]\tvalidation_0-logloss:0.15265\n",
      "[232]\tvalidation_0-logloss:0.15261\n",
      "[233]\tvalidation_0-logloss:0.15257\n",
      "[234]\tvalidation_0-logloss:0.15251\n",
      "[235]\tvalidation_0-logloss:0.15248\n",
      "[236]\tvalidation_0-logloss:0.15241\n",
      "[237]\tvalidation_0-logloss:0.15237\n",
      "[238]\tvalidation_0-logloss:0.15234\n",
      "[239]\tvalidation_0-logloss:0.15226\n",
      "[240]\tvalidation_0-logloss:0.15224\n",
      "[241]\tvalidation_0-logloss:0.15220\n",
      "[242]\tvalidation_0-logloss:0.15217\n",
      "[243]\tvalidation_0-logloss:0.15214\n",
      "[244]\tvalidation_0-logloss:0.15212\n",
      "[245]\tvalidation_0-logloss:0.15204\n",
      "[246]\tvalidation_0-logloss:0.15202\n",
      "[247]\tvalidation_0-logloss:0.15199\n",
      "[248]\tvalidation_0-logloss:0.15198\n",
      "[249]\tvalidation_0-logloss:0.15195\n",
      "[250]\tvalidation_0-logloss:0.15193\n",
      "[251]\tvalidation_0-logloss:0.15191\n",
      "[252]\tvalidation_0-logloss:0.15189\n",
      "[253]\tvalidation_0-logloss:0.15187\n",
      "[254]\tvalidation_0-logloss:0.15185\n",
      "[255]\tvalidation_0-logloss:0.15183\n",
      "[256]\tvalidation_0-logloss:0.15180\n",
      "[257]\tvalidation_0-logloss:0.15175\n",
      "[258]\tvalidation_0-logloss:0.15172\n",
      "[259]\tvalidation_0-logloss:0.15169\n",
      "[260]\tvalidation_0-logloss:0.15167\n",
      "[261]\tvalidation_0-logloss:0.15163\n",
      "[262]\tvalidation_0-logloss:0.15162\n",
      "[263]\tvalidation_0-logloss:0.15160\n",
      "[264]\tvalidation_0-logloss:0.15157\n",
      "[265]\tvalidation_0-logloss:0.15154\n",
      "[266]\tvalidation_0-logloss:0.15152\n",
      "[267]\tvalidation_0-logloss:0.15150\n",
      "[268]\tvalidation_0-logloss:0.15148\n",
      "[269]\tvalidation_0-logloss:0.15142\n",
      "[270]\tvalidation_0-logloss:0.15140\n",
      "[271]\tvalidation_0-logloss:0.15139\n",
      "[272]\tvalidation_0-logloss:0.15136\n",
      "[273]\tvalidation_0-logloss:0.15134\n",
      "[274]\tvalidation_0-logloss:0.15131\n",
      "[275]\tvalidation_0-logloss:0.15129\n",
      "[276]\tvalidation_0-logloss:0.15127\n",
      "[277]\tvalidation_0-logloss:0.15123\n",
      "[278]\tvalidation_0-logloss:0.15118\n",
      "[279]\tvalidation_0-logloss:0.15117\n",
      "[280]\tvalidation_0-logloss:0.15115\n",
      "[281]\tvalidation_0-logloss:0.15114\n",
      "[282]\tvalidation_0-logloss:0.15111\n",
      "[283]\tvalidation_0-logloss:0.15109\n",
      "[284]\tvalidation_0-logloss:0.15108\n",
      "[285]\tvalidation_0-logloss:0.15107\n",
      "[286]\tvalidation_0-logloss:0.15105\n",
      "[287]\tvalidation_0-logloss:0.15104\n",
      "[288]\tvalidation_0-logloss:0.15101\n",
      "[289]\tvalidation_0-logloss:0.15099\n",
      "[290]\tvalidation_0-logloss:0.15093\n",
      "[291]\tvalidation_0-logloss:0.15090\n",
      "[292]\tvalidation_0-logloss:0.15086\n",
      "[293]\tvalidation_0-logloss:0.15084\n",
      "[294]\tvalidation_0-logloss:0.15082\n",
      "[295]\tvalidation_0-logloss:0.15081\n",
      "[296]\tvalidation_0-logloss:0.15076\n",
      "[297]\tvalidation_0-logloss:0.15073\n",
      "[298]\tvalidation_0-logloss:0.15070\n",
      "[299]\tvalidation_0-logloss:0.15067\n",
      "[300]\tvalidation_0-logloss:0.15066\n",
      "[301]\tvalidation_0-logloss:0.15064\n",
      "[302]\tvalidation_0-logloss:0.15063\n",
      "[303]\tvalidation_0-logloss:0.15062\n",
      "[304]\tvalidation_0-logloss:0.15060\n",
      "[305]\tvalidation_0-logloss:0.15058\n",
      "[306]\tvalidation_0-logloss:0.15057\n",
      "[307]\tvalidation_0-logloss:0.15055\n",
      "[308]\tvalidation_0-logloss:0.15053\n",
      "[309]\tvalidation_0-logloss:0.15052\n",
      "[310]\tvalidation_0-logloss:0.15051\n",
      "[311]\tvalidation_0-logloss:0.15049\n",
      "[312]\tvalidation_0-logloss:0.15048\n",
      "[313]\tvalidation_0-logloss:0.15047\n",
      "[314]\tvalidation_0-logloss:0.15044\n",
      "[315]\tvalidation_0-logloss:0.15043\n",
      "[316]\tvalidation_0-logloss:0.15041\n",
      "[317]\tvalidation_0-logloss:0.15039\n",
      "[318]\tvalidation_0-logloss:0.15039\n",
      "[319]\tvalidation_0-logloss:0.15037\n",
      "[320]\tvalidation_0-logloss:0.15036\n",
      "[321]\tvalidation_0-logloss:0.15034\n",
      "[322]\tvalidation_0-logloss:0.15033\n",
      "[323]\tvalidation_0-logloss:0.15032\n",
      "[324]\tvalidation_0-logloss:0.15029\n",
      "[325]\tvalidation_0-logloss:0.15027\n",
      "[326]\tvalidation_0-logloss:0.15027\n",
      "[327]\tvalidation_0-logloss:0.15025\n",
      "[328]\tvalidation_0-logloss:0.15024\n",
      "[329]\tvalidation_0-logloss:0.15023\n",
      "[330]\tvalidation_0-logloss:0.15022\n",
      "[331]\tvalidation_0-logloss:0.15020\n",
      "[332]\tvalidation_0-logloss:0.15018\n",
      "[333]\tvalidation_0-logloss:0.15013\n",
      "[334]\tvalidation_0-logloss:0.15013\n",
      "[335]\tvalidation_0-logloss:0.15012\n",
      "[336]\tvalidation_0-logloss:0.15011\n",
      "[337]\tvalidation_0-logloss:0.15011\n",
      "[338]\tvalidation_0-logloss:0.15011\n",
      "[339]\tvalidation_0-logloss:0.15010\n",
      "[340]\tvalidation_0-logloss:0.15009\n",
      "[341]\tvalidation_0-logloss:0.15007\n",
      "[342]\tvalidation_0-logloss:0.15007\n",
      "[343]\tvalidation_0-logloss:0.15004\n",
      "[344]\tvalidation_0-logloss:0.15003\n",
      "[345]\tvalidation_0-logloss:0.15002\n",
      "[346]\tvalidation_0-logloss:0.15002\n",
      "[347]\tvalidation_0-logloss:0.14999\n",
      "[348]\tvalidation_0-logloss:0.14998\n",
      "[349]\tvalidation_0-logloss:0.14996\n",
      "[350]\tvalidation_0-logloss:0.14995\n",
      "[351]\tvalidation_0-logloss:0.14994\n",
      "[352]\tvalidation_0-logloss:0.14993\n",
      "[353]\tvalidation_0-logloss:0.14992\n",
      "[354]\tvalidation_0-logloss:0.14991\n",
      "[355]\tvalidation_0-logloss:0.14989\n",
      "[356]\tvalidation_0-logloss:0.14988\n",
      "[357]\tvalidation_0-logloss:0.14986\n",
      "[358]\tvalidation_0-logloss:0.14986\n",
      "[359]\tvalidation_0-logloss:0.14984\n",
      "[360]\tvalidation_0-logloss:0.14984\n",
      "[361]\tvalidation_0-logloss:0.14984\n",
      "[362]\tvalidation_0-logloss:0.14982\n",
      "[363]\tvalidation_0-logloss:0.14981\n",
      "[364]\tvalidation_0-logloss:0.14977\n",
      "[365]\tvalidation_0-logloss:0.14976\n",
      "[366]\tvalidation_0-logloss:0.14975\n",
      "[367]\tvalidation_0-logloss:0.14973\n",
      "[368]\tvalidation_0-logloss:0.14971\n",
      "[369]\tvalidation_0-logloss:0.14969\n",
      "[370]\tvalidation_0-logloss:0.14968\n",
      "[371]\tvalidation_0-logloss:0.14968\n",
      "[372]\tvalidation_0-logloss:0.14967\n",
      "[373]\tvalidation_0-logloss:0.14967\n",
      "[374]\tvalidation_0-logloss:0.14965\n",
      "[375]\tvalidation_0-logloss:0.14964\n",
      "[376]\tvalidation_0-logloss:0.14963\n",
      "[377]\tvalidation_0-logloss:0.14962\n",
      "[378]\tvalidation_0-logloss:0.14962\n",
      "[379]\tvalidation_0-logloss:0.14962\n",
      "[380]\tvalidation_0-logloss:0.14961\n",
      "[381]\tvalidation_0-logloss:0.14960\n",
      "[382]\tvalidation_0-logloss:0.14958\n",
      "[383]\tvalidation_0-logloss:0.14956\n",
      "[384]\tvalidation_0-logloss:0.14956\n",
      "[385]\tvalidation_0-logloss:0.14955\n",
      "[386]\tvalidation_0-logloss:0.14954\n",
      "[387]\tvalidation_0-logloss:0.14953\n",
      "[388]\tvalidation_0-logloss:0.14951\n",
      "[389]\tvalidation_0-logloss:0.14950\n",
      "[390]\tvalidation_0-logloss:0.14949\n",
      "[391]\tvalidation_0-logloss:0.14947\n",
      "[392]\tvalidation_0-logloss:0.14946\n",
      "[393]\tvalidation_0-logloss:0.14944\n",
      "[394]\tvalidation_0-logloss:0.14944\n",
      "[395]\tvalidation_0-logloss:0.14942\n",
      "[396]\tvalidation_0-logloss:0.14941\n",
      "[397]\tvalidation_0-logloss:0.14940\n",
      "[398]\tvalidation_0-logloss:0.14940\n",
      "[399]\tvalidation_0-logloss:0.14938\n",
      "[400]\tvalidation_0-logloss:0.14937\n",
      "[401]\tvalidation_0-logloss:0.14937\n",
      "[402]\tvalidation_0-logloss:0.14936\n",
      "[403]\tvalidation_0-logloss:0.14936\n",
      "[404]\tvalidation_0-logloss:0.14935\n",
      "[405]\tvalidation_0-logloss:0.14934\n",
      "[406]\tvalidation_0-logloss:0.14934\n",
      "[407]\tvalidation_0-logloss:0.14932\n",
      "[408]\tvalidation_0-logloss:0.14932\n",
      "[409]\tvalidation_0-logloss:0.14930\n",
      "[410]\tvalidation_0-logloss:0.14929\n",
      "[411]\tvalidation_0-logloss:0.14929\n",
      "[412]\tvalidation_0-logloss:0.14928\n",
      "[413]\tvalidation_0-logloss:0.14928\n",
      "[414]\tvalidation_0-logloss:0.14928\n",
      "[415]\tvalidation_0-logloss:0.14926\n",
      "[416]\tvalidation_0-logloss:0.14926\n",
      "[417]\tvalid